SQL*Plus: Release 11.2.0.2.0 Production on Wed Feb 8 00:29:57 2023
Copyright (c) 1982, 2014, Oracle.  All rights reserved.

SQL> conn Abhi/Abhi;
Connected.

SQL>  create table emp(ID number(5),NAME varchar(9),AGE number(3),SAL number(7),LOC varchar(9),DOJ date,STATUS varchar(5));

Table created.

SQL> insert into emp values(14,'raj',27,4000,'ind','23-Jan-97','m');

1 row created.

SQL> select * from emp;

        ID NAME             AGE        SAL LOC       DOJ       STATU
---------- --------- ---------- ---------- --------- --------- -----
        14 raj               27       4000 ind       23-JAN-97 m

SQL> insert into emp values(19,'mark',37,9000,'aus','18-Mar-99','m');

1 row created.

SQL> insert into emp values(16,'nick',29,7600,'eng','27-JUN-03','u');

1 row created.

SQL> insert into emp values(11,'sameer',39,5500,'ind','11-NOV-86','m');

1 row created.

SQL> insert into emp values(23,'William',25,9700,'nz','19-JAN-88','u');

1 row created.

SQL> insert into emp values(23,'ahmed',30,1500,'Pak',null,'m');

1 row created.

SQL> insert into emp values(23,'Steve',36,7700,'aus','5-MAY-02','m');

1 row created.

SQL> insert into emp values(26,'kartik',25,4800,'ind',null,null);

1 row created.

SQL> insert into emp values(18,'collin',22,2000,'eng','16-NOV-95','m');

1 row created.

SQL> insert into emp values(27,'Priti',31,2600,'ind','13-APR-97','u');

1 row created.

SQL> insert into emp values(18,'Lance',42,8900,'sa','05-DEC-95','m');

1 row created.


SQL> select * from emp;

        ID NAME             AGE        SAL LOC       DOJ       STATU
---------- --------- ---------- ---------- --------- --------- -----
        14 raj               27       4000 ind       23-JAN-97 m
        19 mark              37       9000 aus       18-MAR-99 m
        16 nick              29       7600 eng       27-JUN-03 u
        11 sameer            39       5500 ind       11-NOV-86 m
        23 William           25       9700 nz        19-JAN-88 u
        23 ahmed             30       1500 Pak                 m
        23 Steve             36       7700 aus       05-MAY-02 m
        26 kartik            25       4800 ind
        18 collin            22       2000 eng       16-NOV-95 m
        27 Priti             31       2600 ind       13-APR-97 u
        18 Lance             42       8900 sa        05-DEC-95 m

11 rows selected.

SQL> desc emp;
 Name                                      Null?    Type
 ----------------------------------------- -------- ----------------------------
 ID                                                 NUMBER(5)
 NAME                                               VARCHAR2(9)
 AGE                                                NUMBER(3)
 SAL                                                NUMBER(7)
 LOC                                                VARCHAR2(9)
 DOJ                                                DATE
 STATUS                                             VARCHAR2(5)

SQL> select * from emp where LOC!='ind';

        ID NAME             AGE        SAL LOC       DOJ       STATU
---------- --------- ---------- ---------- --------- --------- -----
        19 mark              37       9000 aus       18-MAR-99 m
        16 nick              29       7600 eng       27-JUN-03 u
        23 William           25       9700 nz        19-JAN-88 u
        23 ahmed             30       1500 Pak                 m
        23 Steve             36       7700 aus       05-MAY-02 m
        18 collin            22       2000 eng       16-NOV-95 m
        18 Lance             42       8900 sa        05-DEC-95 m

7 rows selected.

SQL> select * from emp where AGE>30 and AGE<40;

        ID NAME             AGE        SAL LOC       DOJ       STATU
---------- --------- ---------- ---------- --------- --------- -----
        19 mark              37       9000 aus       18-MAR-99 m
        11 sameer            39       5500 ind       11-NOV-86 m
        23 Steve             36       7700 aus       05-MAY-02 m
        27 Priti             31       2600 ind       13-APR-97 u

SQL> select SAL-500 from emp where AGE<32;

   SAL-500
----------
      3500
      7100
      9200
      1000
      4300
      1500
      2100

7 rows selected.

SQL> select ID from emp;

        ID
----------
        14
        19
        16
        11
        23
        23
        23
        26
        18
        27
        18

11 rows selected.

SQL> select AGE||''||LOC from emp;

AGE||''||LOC
-------------------------------------------------
27ind
37aus
29eng
39ind
25nz
30Pak
36aus
25ind
22eng
31ind
42sa

11 rows selected.

SQL> select * from emp order by ID desc,SAL;

        ID NAME             AGE        SAL LOC       DOJ       STATU
---------- --------- ---------- ---------- --------- --------- -----
        27 Priti             31       2600 ind       13-APR-97 u
        26 kartik            25       4800 ind
        23 ahmed             30       1500 Pak                 m
        23 Steve             36       7700 aus       05-MAY-02 m
        23 William           25       9700 nz        19-JAN-88 u
        19 mark              37       9000 aus       18-MAR-99 m
        18 collin            22       2000 eng       16-NOV-95 m
        18 Lance             42       8900 sa        05-DEC-95 m
        16 nick              29       7600 eng       27-JUN-03 u
        14 raj               27       4000 ind       23-JAN-97 m
        11 sameer            39       5500 ind       11-NOV-86 m

11 rows selected.

SQL> select * from emp where DOJ > '1-JAN-96' and DOJ < '31-DEC-01';

        ID NAME             AGE        SAL LOC       DOJ       STATU
---------- --------- ---------- ---------- --------- --------- -----
        14 raj               27       4000 ind       23-JAN-97 m
        19 mark              37       9000 aus       18-MAR-99 m
        27 Priti             31       2600 ind       13-APR-97 u

SQL> select * from emp where status = 'u';

        ID NAME             AGE        SAL LOC       DOJ       STATU
---------- --------- ---------- ---------- --------- --------- -----
        16 nick              29       7600 eng       27-JUN-03 u
        23 William           25       9700 nz        19-JAN-88 u
        27 Priti             31       2600 ind       13-APR-97 u

SQL> select ID from emp where status='m' and LOC = 'ind';

        ID
----------
        14
        11

SQL> select AGE,DOJ from emp where SAL > 7900;

       AGE DOJ
---------- ---------
        37 18-MAR-99
        25 19-JAN-88
        42 05-DEC-95

SQL> select * from emp where SAL!=5500 and SAL!=8900;

        ID NAME             AGE        SAL LOC       DOJ       STATU
---------- --------- ---------- ---------- --------- --------- -----
        14 raj               27       4000 ind       23-JAN-97 m
        19 mark              37       9000 aus       18-MAR-99 m
        16 nick              29       7600 eng       27-JUN-03 u
        23 William           25       9700 nz        19-JAN-88 u
        23 ahmed             30       1500 Pak                 m
        23 Steve             36       7700 aus       05-MAY-02 m
        26 kartik            25       4800 ind
        18 collin            22       2000 eng       16-NOV-95 m
        27 Priti             31       2600 ind       13-APR-97 u

9 rows selected.

SQL> select ID from emp where LOC = 'ind' or SAL > 6000;

        ID
----------
        14
        19
        16
        11
        23
        23
        26
        27
        18

9 rows selected.

SQL> select AGE,LOC from emp where DOJ is NULL;

       AGE LOC
---------- ---------
        30 Pak
        25 ind

SQL> select * from emp where name like '%m' and SAL>6000;

        ID NAME             AGE        SAL LOC       DOJ       STATU
---------- --------- ---------- ---------- --------- --------- -----
        23 William           25       9700 nz        19-JAN-88 u

SQL> select * from emp where name like '%m%' and SAL>6000;

        ID NAME             AGE        SAL LOC       DOJ       STATU
---------- --------- ---------- ---------- --------- --------- -----
        19 mark              37       9000 aus       18-MAR-99 m
        23 William           25       9700 nz        19-JAN-88 u

SQL> select * from emp where name not like '%a%';

        ID NAME             AGE        SAL LOC       DOJ       STATU
---------- --------- ---------- ---------- --------- --------- -----
        16 nick              29       7600 eng       27-JUN-03 u
        23 Steve             36       7700 aus       05-MAY-02 m
        18 collin            22       2000 eng       16-NOV-95 m
        27 Priti             31       2600 ind       13-APR-97 u

SQL> alter table emp modify(LOC varchar2(15));

Table altered.

SQL> desc emp;
 Name                                      Null?    Type
 ----------------------------------------- -------- ----------------------------
 ID                                                 NUMBER(5)
 NAME                                               VARCHAR2(9)
 AGE                                                NUMBER(3)
 SAL                                                NUMBER(7)
 LOC                                                VARCHAR2(15)
 DOJ                                                DATE
 STATUS                                             VARCHAR2(5)

SQL> alter table emp add(EMAIL varchar2(20));

Table altered.

SQL> desc emp;
 Name                                      Null?    Type
 ----------------------------------------- -------- ----------------------------
 ID                                                 NUMBER(5)
 NAME                                               VARCHAR2(9)
 AGE                                                NUMBER(3)
 SAL                                                NUMBER(7)
 LOC                                                VARCHAR2(15)
 DOJ                                                DATE
 STATUS                                             VARCHAR2(5)
 EMAIL                                              VARCHAR2(20)

SQL> select id from emp where SAL < 5200;

        ID
----------
        14
        23
        26
        18
        27

SQL> select * from emp where NAME like '%ll%';

        ID NAME             AGE        SAL LOC             DOJ       STATU
---------- --------- ---------- ---------- --------------- --------- -----
EMAIL
--------------------
        23 William           25       9700 nz              19-JAN-88 u


        18 collin            22       2000 eng             16-NOV-95 m



SQL> select age from emp where NAME like 'r__';

       AGE
----------
        27

SQL> select * from emp where NAME not like 's%';

        ID NAME             AGE        SAL LOC             DOJ       STATU
---------- --------- ---------- ---------- --------------- --------- -----
EMAIL
--------------------
        14 raj               27       4000 ind             23-JAN-97 m


        19 mark              37       9000 aus             18-MAR-99 m


        16 nick              29       7600 eng             27-JUN-03 u



        ID NAME             AGE        SAL LOC             DOJ       STATU
---------- --------- ---------- ---------- --------------- --------- -----
EMAIL
--------------------
        23 William           25       9700 nz              19-JAN-88 u


        23 ahmed             30       1500 Pak                       m


        23 Steve             36       7700 aus             05-MAY-02 m



        ID NAME             AGE        SAL LOC             DOJ       STATU
---------- --------- ---------- ---------- --------------- --------- -----
EMAIL
--------------------
        26 kartik            25       4800 ind


        18 collin            22       2000 eng             16-NOV-95 m


        27 Priti             31       2600 ind             13-APR-97 u



        ID NAME             AGE        SAL LOC             DOJ       STATU
---------- --------- ---------- ---------- --------------- --------- -----
EMAIL
--------------------
        18 Lance             42       8900 sa              05-DEC-95 m



10 rows selected.

SQL> update emp set LOC = 'ind' where AGE > 35;

4 rows updated.

SQL> select * from emp;

        ID NAME             AGE        SAL LOC             DOJ       STATU
---------- --------- ---------- ---------- --------------- --------- -----
EMAIL
--------------------
        14 raj               27       4000 ind             23-JAN-97 m


        19 mark              37       9000 ind             18-MAR-99 m


        16 nick              29       7600 eng             27-JUN-03 u



        ID NAME             AGE        SAL LOC             DOJ       STATU
---------- --------- ---------- ---------- --------------- --------- -----
EMAIL
--------------------
        11 sameer            39       5500 ind             11-NOV-86 m


        23 William           25       9700 nz              19-JAN-88 u


        23 ahmed             30       1500 Pak                       m



        ID NAME             AGE        SAL LOC             DOJ       STATU
---------- --------- ---------- ---------- --------------- --------- -----
EMAIL
--------------------
        23 Steve             36       7700 ind             05-MAY-02 m


        26 kartik            25       4800 ind


        18 collin            22       2000 eng             16-NOV-95 m



        ID NAME             AGE        SAL LOC             DOJ       STATU
---------- --------- ---------- ---------- --------------- --------- -----
EMAIL
--------------------
        27 Priti             31       2600 ind             13-APR-97 u


        18 Lance             42       8900 ind             05-DEC-95 m



11 rows selected.

SQL> update emp set EMAIL = 'xyz@kiit.ac.in';

11 rows updated.

SQL> select * from emp;

        ID NAME             AGE        SAL LOC             DOJ       STATU
---------- --------- ---------- ---------- --------------- --------- -----
EMAIL
--------------------
        14 raj               27       4000 ind             23-JAN-97 m
xyz@kiit.ac.in

        19 mark              37       9000 ind             18-MAR-99 m
xyz@kiit.ac.in

        16 nick              29       7600 eng             27-JUN-03 u
xyz@kiit.ac.in


        ID NAME             AGE        SAL LOC             DOJ       STATU
---------- --------- ---------- ---------- --------------- --------- -----
EMAIL
--------------------
        11 sameer            39       5500 ind             11-NOV-86 m
xyz@kiit.ac.in

        23 William           25       9700 nz              19-JAN-88 u
xyz@kiit.ac.in

        23 ahmed             30       1500 Pak                       m
xyz@kiit.ac.in


        ID NAME             AGE        SAL LOC             DOJ       STATU
---------- --------- ---------- ---------- --------------- --------- -----
EMAIL
--------------------
        23 Steve             36       7700 ind             05-MAY-02 m
xyz@kiit.ac.in

        26 kartik            25       4800 ind
xyz@kiit.ac.in

        18 collin            22       2000 eng             16-NOV-95 m
xyz@kiit.ac.in


        ID NAME             AGE        SAL LOC             DOJ       STATU
---------- --------- ---------- ---------- --------------- --------- -----
EMAIL
--------------------
        27 Priti             31       2600 ind             13-APR-97 u
xyz@kiit.ac.in

        18 Lance             42       8900 ind             05-DEC-95 m
xyz@kiit.ac.in


11 rows selected.

SQL> delete from emp where name = 'collin';

1 row deleted.

SQL> select * from emp;

        ID NAME             AGE        SAL LOC             DOJ       STATU
---------- --------- ---------- ---------- --------------- --------- -----
EMAIL
--------------------
        14 raj               27       4000 ind             23-JAN-97 m
xyz@kiit.ac.in

        19 mark              37       9000 ind             18-MAR-99 m
xyz@kiit.ac.in

        16 nick              29       7600 eng             27-JUN-03 u
xyz@kiit.ac.in


        ID NAME             AGE        SAL LOC             DOJ       STATU
---------- --------- ---------- ---------- --------------- --------- -----
EMAIL
--------------------
        11 sameer            39       5500 ind             11-NOV-86 m
xyz@kiit.ac.in

        23 William           25       9700 nz              19-JAN-88 u
xyz@kiit.ac.in

        23 ahmed             30       1500 Pak                       m
xyz@kiit.ac.in


        ID NAME             AGE        SAL LOC             DOJ       STATU
---------- --------- ---------- ---------- --------------- --------- -----
EMAIL
--------------------
        23 Steve             36       7700 ind             05-MAY-02 m
xyz@kiit.ac.in

        26 kartik            25       4800 ind
xyz@kiit.ac.in

        27 Priti             31       2600 ind             13-APR-97 u
xyz@kiit.ac.in


        ID NAME             AGE        SAL LOC             DOJ       STATU
---------- --------- ---------- ---------- --------------- --------- -----
EMAIL
--------------------
        18 Lance             42       8900 ind             05-DEC-95 m
xyz@kiit.ac.in


10 rows selected.

SQL> rename emp to employee_regenerate;

Table renamed.

SQL> update employee_regenerate set SAL = 6000 where status ='u';

3 rows updated.

SQL> select * from employee_regenerate;

        ID NAME             AGE        SAL LOC             DOJ       STATU
---------- --------- ---------- ---------- --------------- --------- -----
EMAIL
--------------------
        14 raj               27       4000 ind             23-JAN-97 m
xyz@kiit.ac.in

        19 mark              37       9000 ind             18-MAR-99 m
xyz@kiit.ac.in

        16 nick              29       6000 eng             27-JUN-03 u
xyz@kiit.ac.in


        ID NAME             AGE        SAL LOC             DOJ       STATU
---------- --------- ---------- ---------- --------------- --------- -----
EMAIL
--------------------
        11 sameer            39       5500 ind             11-NOV-86 m
xyz@kiit.ac.in

        23 William           25       6000 nz              19-JAN-88 u
xyz@kiit.ac.in

        23 ahmed             30       1500 Pak                       m
xyz@kiit.ac.in


        ID NAME             AGE        SAL LOC             DOJ       STATU
---------- --------- ---------- ---------- --------------- --------- -----
EMAIL
--------------------
        23 Steve             36       7700 ind             05-MAY-02 m
xyz@kiit.ac.in

        26 kartik            25       4800 ind
xyz@kiit.ac.in

        27 Priti             31       6000 ind             13-APR-97 u
xyz@kiit.ac.in


        ID NAME             AGE        SAL LOC             DOJ       STATU
---------- --------- ---------- ---------- --------------- --------- -----
EMAIL
--------------------
        18 Lance             42       8900 ind             05-DEC-95 m
xyz@kiit.ac.in


10 rows selected.

SQL> insert into employee_regenerate (ID,NAME,SAL) values (34,'kartik',9000);

1 row created.

SQL> select * from employee_regenerate;

        ID NAME             AGE        SAL LOC             DOJ       STATU
---------- --------- ---------- ---------- --------------- --------- -----
EMAIL
--------------------
        14 raj               27       4000 ind             23-JAN-97 m
xyz@kiit.ac.in

        19 mark              37       9000 ind             18-MAR-99 m
xyz@kiit.ac.in

        16 nick              29       6000 eng             27-JUN-03 u
xyz@kiit.ac.in


        ID NAME             AGE        SAL LOC             DOJ       STATU
---------- --------- ---------- ---------- --------------- --------- -----
EMAIL
--------------------
        11 sameer            39       5500 ind             11-NOV-86 m
xyz@kiit.ac.in

        23 William           25       6000 nz              19-JAN-88 u
xyz@kiit.ac.in

        23 ahmed             30       1500 Pak                       m
xyz@kiit.ac.in


        ID NAME             AGE        SAL LOC             DOJ       STATU
---------- --------- ---------- ---------- --------------- --------- -----
EMAIL
--------------------
        23 Steve             36       7700 ind             05-MAY-02 m
xyz@kiit.ac.in

        26 kartik            25       4800 ind
xyz@kiit.ac.in

        34 kartik                     9000



        ID NAME             AGE        SAL LOC             DOJ       STATU
---------- --------- ---------- ---------- --------------- --------- -----
EMAIL
--------------------
        27 Priti             31       6000 ind             13-APR-97 u
xyz@kiit.ac.in

        18 Lance             42       8900 ind             05-DEC-95 m
xyz@kiit.ac.in


11 rows selected.

SQL> select SAL from employee_regenerate where NAME like 'c_i_in%';

no rows selected

SQL> commit;

Commit complete.

SQL>