SQL> conn Abhi/Abhi
Connected.

SQL> select * from Worker order by ID;

        ID NAME             AGE        SAL EMAIL                LOC
---------- --------- ---------- ---------- -------------------- ---------
     PHONE GENDE
---------- -----
         2 Robert            37      36000 rb@gmail.com         USA
    123897 M

         4 Andrew            22      25000 ad@gmail.com         ENG
    778943 M

         7 Seren             39      72000 dk@gmail.com         ENG
           F


        ID NAME             AGE        SAL EMAIL                LOC
---------- --------- ---------- ---------- -------------------- ---------
     PHONE GENDE
---------- -----
         9 Ritu              43      65000 rt@gmail.com         IND
    213567 F

        11 Mathews           40      27000 mt@gmail.com         NZ
    349002 M

        12 Rome              23      30000 rm@gmail.com         AUS
    987654 M


        ID NAME             AGE        SAL EMAIL                LOC
---------- --------- ---------- ---------- -------------------- ---------
     PHONE GENDE
---------- -----
        14 Frost             35      45000 ft@gmail.com         NZ
    763455 M

        14 Patrick           45      55000 pt@gmail.com         ENG
    371189 M

        14 Jimmy             32      39000 jm@gmail.com         AUS
    450091 M


        ID NAME             AGE        SAL EMAIL                LOC
---------- --------- ---------- ---------- -------------------- ---------
     PHONE GENDE
---------- -----
        16 Sagnik            29      18000 sg@gmail.com         IND
    324567 M


10 rows selected.


SQL> select * from Worker order by AGE;

        ID NAME             AGE        SAL EMAIL                LOC
---------- --------- ---------- ---------- -------------------- ---------
     PHONE GENDE
---------- -----
         4 Andrew            22      25000 ad@gmail.com         ENG
    778943 M

        12 Rome              23      30000 rm@gmail.com         AUS
    987654 M

        16 Sagnik            29      18000 sg@gmail.com         IND
    324567 M


        ID NAME             AGE        SAL EMAIL                LOC
---------- --------- ---------- ---------- -------------------- ---------
     PHONE GENDE
---------- -----
        14 Jimmy             32      39000 jm@gmail.com         AUS
    450091 M

        14 Frost             35      45000 ft@gmail.com         NZ
    763455 M

         2 Robert            37      36000 rb@gmail.com         USA
    123897 M


        ID NAME             AGE        SAL EMAIL                LOC
---------- --------- ---------- ---------- -------------------- ---------
     PHONE GENDE
---------- -----
         7 Seren             39      72000 dk@gmail.com         ENG
           F

        11 Mathews           40      27000 mt@gmail.com         NZ
    349002 M

         9 Ritu              43      65000 rt@gmail.com         IND
    213567 F


        ID NAME             AGE        SAL EMAIL                LOC
---------- --------- ---------- ---------- -------------------- ---------
     PHONE GENDE
---------- -----
        14 Patrick           45      55000 pt@gmail.com         ENG
    371189 M


10 rows selected.


SQL> select * from Worker order by 1, 2;

        ID NAME             AGE        SAL EMAIL                LOC
---------- --------- ---------- ---------- -------------------- ---------
     PHONE GENDE
---------- -----
         2 Robert            37      36000 rb@gmail.com         USA
    123897 M

         4 Andrew            22      25000 ad@gmail.com         ENG
    778943 M

         7 Seren             39      72000 dk@gmail.com         ENG
           F


        ID NAME             AGE        SAL EMAIL                LOC
---------- --------- ---------- ---------- -------------------- ---------
     PHONE GENDE
---------- -----
         9 Ritu              43      65000 rt@gmail.com         IND
    213567 F

        11 Mathews           40      27000 mt@gmail.com         NZ
    349002 M

        12 Rome              23      30000 rm@gmail.com         AUS
    987654 M


        ID NAME             AGE        SAL EMAIL                LOC
---------- --------- ---------- ---------- -------------------- ---------
     PHONE GENDE
---------- -----
        14 Frost             35      45000 ft@gmail.com         NZ
    763455 M

        14 Jimmy             32      39000 jm@gmail.com         AUS
    450091 M

        14 Patrick           45      55000 pt@gmail.com         ENG
    371189 M


        ID NAME             AGE        SAL EMAIL                LOC
---------- --------- ---------- ---------- -------------------- ---------
     PHONE GENDE
---------- -----
        16 Sagnik            29      18000 sg@gmail.com         IND
    324567 M


10 rows selected.


SQL> select * from Worker order by 1, 2 desc;

        ID NAME             AGE        SAL EMAIL                LOC
---------- --------- ---------- ---------- -------------------- ---------
     PHONE GENDE
---------- -----
         2 Robert            37      36000 rb@gmail.com         USA
    123897 M

         4 Andrew            22      25000 ad@gmail.com         ENG
    778943 M

         7 Seren             39      72000 dk@gmail.com         ENG
           F


        ID NAME             AGE        SAL EMAIL                LOC
---------- --------- ---------- ---------- -------------------- ---------
     PHONE GENDE
---------- -----
         9 Ritu              43      65000 rt@gmail.com         IND
    213567 F

        11 Mathews           40      27000 mt@gmail.com         NZ
    349002 M

        12 Rome              23      30000 rm@gmail.com         AUS
    987654 M


        ID NAME             AGE        SAL EMAIL                LOC
---------- --------- ---------- ---------- -------------------- ---------
     PHONE GENDE
---------- -----
        14 Patrick           45      55000 pt@gmail.com         ENG
    371189 M

        14 Jimmy             32      39000 jm@gmail.com         AUS
    450091 M

        14 Frost             35      45000 ft@gmail.com         NZ
    763455 M


        ID NAME             AGE        SAL EMAIL                LOC
---------- --------- ---------- ---------- -------------------- ---------
     PHONE GENDE
---------- -----
        16 Sagnik            29      18000 sg@gmail.com         IND
    324567 M


10 rows selected.


SQL> alter table Worker add(Op Varchar2(10));

Table altered.


SQL> select * from Worker;

        ID NAME             AGE        SAL EMAIL                LOC
---------- --------- ---------- ---------- -------------------- ---------
     PHONE GENDE OP
---------- ----- ----------
        12 Rome              23      30000 rm@gmail.com         AUS
    987654 M

        14 Frost             35      45000 ft@gmail.com         NZ
    763455 M

         9 Ritu              43      65000 rt@gmail.com         IND
    213567 F


        ID NAME             AGE        SAL EMAIL                LOC
---------- --------- ---------- ---------- -------------------- ---------
     PHONE GENDE OP
---------- ----- ----------
         4 Andrew            22      25000 ad@gmail.com         ENG
    778943 M

        16 Sagnik            29      18000 sg@gmail.com         IND
    324567 M

         2 Robert            37      36000 rb@gmail.com         USA
    123897 M


        ID NAME             AGE        SAL EMAIL                LOC
---------- --------- ---------- ---------- -------------------- ---------
     PHONE GENDE OP
---------- ----- ----------
        14 Patrick           45      55000 pt@gmail.com         ENG
    371189 M

         7 Seren             39      72000 dk@gmail.com         ENG
           F

        14 Jimmy             32      39000 jm@gmail.com         AUS
    450091 M


        ID NAME             AGE        SAL EMAIL                LOC
---------- --------- ---------- ---------- -------------------- ---------
     PHONE GENDE OP
---------- ----- ----------
        11 Mathews           40      27000 mt@gmail.com         NZ
    349002 M


10 rows selected.

SQL> update Worker set OP ='india';

10 rows updated.

SQL> select * from Worker;

        ID NAME             AGE        SAL EMAIL                LOC
---------- --------- ---------- ---------- -------------------- ---------
     PHONE GENDE OP
---------- ----- ----------
        12 Rome              23      30000 rm@gmail.com         AUS
    987654 M     india

        14 Frost             35      45000 ft@gmail.com         NZ
    763455 M     india

         9 Ritu              43      65000 rt@gmail.com         IND
    213567 F     india


        ID NAME             AGE        SAL EMAIL                LOC
---------- --------- ---------- ---------- -------------------- ---------
     PHONE GENDE OP
---------- ----- ----------
         4 Andrew            22      25000 ad@gmail.com         ENG
    778943 M     india

        16 Sagnik            29      18000 sg@gmail.com         IND
    324567 M     india

         2 Robert            37      36000 rb@gmail.com         USA
    123897 M     india


        ID NAME             AGE        SAL EMAIL                LOC
---------- --------- ---------- ---------- -------------------- ---------
     PHONE GENDE OP
---------- ----- ----------
        14 Patrick           45      55000 pt@gmail.com         ENG
    371189 M     india

         7 Seren             39      72000 dk@gmail.com         ENG
           F     india

        14 Jimmy             32      39000 jm@gmail.com         AUS
    450091 M     india


        ID NAME             AGE        SAL EMAIL                LOC
---------- --------- ---------- ---------- -------------------- ---------
     PHONE GENDE OP
---------- ----- ----------
        11 Mathews           40      27000 mt@gmail.com         NZ
    349002 M     india


10 rows selected.


SQL> update Worker set OP ='india' where ID = 14;

3 rows updated.


SQL> select * from Worker;

        ID NAME             AGE        SAL EMAIL                LOC
---------- --------- ---------- ---------- -------------------- ---------
     PHONE GENDE OP
---------- ----- ----------
        12 Rome              23      30000 rm@gmail.com         AUS
    987654 M     india

        14 Frost             35      45000 ft@gmail.com         NZ
    763455 M     india

         9 Ritu              43      65000 rt@gmail.com         IND
    213567 F     india


        ID NAME             AGE        SAL EMAIL                LOC
---------- --------- ---------- ---------- -------------------- ---------
     PHONE GENDE OP
---------- ----- ----------
         4 Andrew            22      25000 ad@gmail.com         ENG
    778943 M     india

        16 Sagnik            29      18000 sg@gmail.com         IND
    324567 M     india

         2 Robert            37      36000 rb@gmail.com         USA
    123897 M     india


        ID NAME             AGE        SAL EMAIL                LOC
---------- --------- ---------- ---------- -------------------- ---------
     PHONE GENDE OP
---------- ----- ----------
        14 Patrick           45      55000 pt@gmail.com         ENG
    371189 M     india

         7 Seren             39      72000 dk@gmail.com         ENG
           F     india

        14 Jimmy             32      39000 jm@gmail.com         AUS
    450091 M     india


        ID NAME             AGE        SAL EMAIL                LOC
---------- --------- ---------- ---------- -------------------- ---------
     PHONE GENDE OP
---------- ----- ----------
        11 Mathews           40      27000 mt@gmail.com         NZ
    349002 M     india


10 rows selected.

SQL> select * from Worker;

        ID NAME             AGE        SAL EMAIL                LOC
---------- --------- ---------- ---------- -------------------- ---------
     PHONE GENDE OP
---------- ----- ----------
        12 Rome              23      30000 rm@gmail.com         AUS
    987654 M     india

        14 Frost             35      45000 ft@gmail.com         NZ
    763455 M     india

         9 Ritu              43      65000 rt@gmail.com         IND
    213567 F     india


        ID NAME             AGE        SAL EMAIL                LOC
---------- --------- ---------- ---------- -------------------- ---------
     PHONE GENDE OP
---------- ----- ----------
         4 Andrew            22      25000 ad@gmail.com         ENG
    778943 M     india

        16 Sagnik            29      18000 sg@gmail.com         IND
    324567 M     india

         2 Robert            37      36000 rb@gmail.com         USA
    123897 M     india


        ID NAME             AGE        SAL EMAIL                LOC
---------- --------- ---------- ---------- -------------------- ---------
     PHONE GENDE OP
---------- ----- ----------
        14 Patrick           45      55000 pt@gmail.com         ENG
    371189 M     india

         7 Seren             39      72000 dk@gmail.com         ENG
           F     india

        14 Jimmy             32      39000 jm@gmail.com         AUS
    450091 M     india


        ID NAME             AGE        SAL EMAIL                LOC
---------- --------- ---------- ---------- -------------------- ---------
     PHONE GENDE OP
---------- ----- ----------
        11 Mathews           40      27000 mt@gmail.com         NZ
    349002 M     india


10 rows selected.


SQL>  create table emp(ID number(5),NAME varchar(9),AGE number(3),SAL number(7),LOC varchar(9),DOJ date,STATUS varchar(5));

Table created.

SQL> insert into emp values(14,'raj',27,4000,'ind','23-Jan-97','m');

1 row created.

SQL> select * from emp;

        ID NAME             AGE        SAL LOC       DOJ       STATU
---------- --------- ---------- ---------- --------- --------- -----
        14 raj               27       4000 ind       23-JAN-97 m

SQL> insert into emp values(19,'mark',37,9000,'aus','18-Mar-99','m');

1 row created.

SQL> insert into emp values(16,'nick',29,7600,'eng','27-JUN-03','u');

1 row created.

SQL> insert into emp values(11,'sameer',39,5500,'ind','11-NOV-86','m');

1 row created.

SQL> insert into emp values(23,'William',25,9700,'nz','19-JAN-88','u');

1 row created.

SQL> insert into emp values(23,'ahmed',30,1500,'Pak',null,'m');

1 row created.

SQL> insert into emp values(23,'Steve',36,7700,'aus','5-MAY-02','m');

1 row created.

SQL> insert into emp values(26,'kartik',25,4800,'ind',null,null);

1 row created.

SQL> insert into emp values(18,'collin',22,2000,'eng','16-NOV-95','m');

1 row created.

SQL> insert into emp values(27,'Priti',31,2600,'ind','13-APR-97','u');

1 row created.

SQL> insert into emp values(18,'Lance',42,8900,'sa','05-DEC-95','m');

1 row created.

SQL> select * from emp;

        ID NAME             AGE        SAL LOC       DOJ       STATU
---------- --------- ---------- ---------- --------- --------- -----
        14 raj               27       4000 ind       23-JAN-97 m
        19 mark              37       9000 aus       18-MAR-99 m
        16 nick              29       7600 eng       27-JUN-03 u
        11 sameer            39       5500 ind       11-NOV-86 m
        23 William           25       9700 nz        19-JAN-88 u
        23 ahmed             30       1500 Pak                 m
        23 Steve             36       7700 aus       05-MAY-02 m
        26 kartik            25       4800 ind
        18 collin            22       2000 eng       16-NOV-95 m
        27 Priti             31       2600 ind       13-APR-97 u
        18 Lance             42       8900 sa        05-DEC-95 m

11 rows selected.


SQL> commit;

Commit complete.


SQL> select * from emp where LOC !='ind';

        ID NAME             AGE        SAL LOC       DOJ       STATU
---------- --------- ---------- ---------- --------- --------- -----
        19 mark              37       9000 aus       18-MAR-99 m
        16 nick              29       7600 eng       27-JUN-03 u
        23 William           25       9700 nz        19-JAN-88 u
        23 ahmed             30       1500 Pak                 m
        23 Steve             36       7700 aus       05-MAY-02 m
        18 collin            22       2000 eng       16-NOV-95 m
        18 Lance             42       8900 sa        05-DEC-95 m

7 rows selected.


SQL> select AGE from emp where AGE BETWEEN 30 AND 40;

       AGE
----------
        37
        39
        30
        36
        31


SQL> select SAL-500 from emp where AGE < 32;

   SAL-500
----------
      3500
      7100
      9200
      1000
      4300
      1500
      2100

7 rows selected.


SQL> select DISTINCT ID from emp;

        ID
----------
        11
        14
        26
        23
        18
        27
        19
        16

8 rows selected.


SQL> select DISTINCT LOC from emp;

LOC
---------
aus
eng
ind
nz
Pak
sa

6 rows selected.


SQL> select AGE ||''|| LOC ID from emp;

ID
-------------------------------------------------
27ind
37aus
29eng
39ind
25nz
30Pak
36aus
25ind
22eng
31ind
42sa

11 rows selected.

SQL> select AGE ||''|| LOC from emp;


AGE||''||LOC
-------------------------------------------------
27ind
37aus
29eng
39ind
25nz
30Pak
36aus
25ind
22eng
31ind
42sa

11 rows selected.

SQL> select AGE ||''|| LOC age_adr from emp;


AGE_ADR
-------------------------------------------------
27ind
37aus
29eng
39ind
25nz
30Pak
36aus
25ind
22eng
31ind
42sa

11 rows selected.


SQL> select * from emp ORDER by ID DESC;

        ID NAME             AGE        SAL LOC       DOJ       STATU
---------- --------- ---------- ---------- --------- --------- -----
        27 Priti             31       2600 ind       13-APR-97 u
        26 kartik            25       4800 ind
        23 ahmed             30       1500 Pak                 m
        23 Steve             36       7700 aus       05-MAY-02 m
        23 William           25       9700 nz        19-JAN-88 u
        19 mark              37       9000 aus       18-MAR-99 m
        18 Lance             42       8900 sa        05-DEC-95 m
        18 collin            22       2000 eng       16-NOV-95 m
        16 nick              29       7600 eng       27-JUN-03 u
        14 raj               27       4000 ind       23-JAN-97 m
        11 sameer            39       5500 ind       11-NOV-86 m

11 rows selected.


SQL> select * from emp ORDER by SAL, ID DESC;

        ID NAME             AGE        SAL LOC       DOJ       STATU
---------- --------- ---------- ---------- --------- --------- -----
        23 ahmed             30       1500 Pak                 m
        18 collin            22       2000 eng       16-NOV-95 m
        27 Priti             31       2600 ind       13-APR-97 u
        14 raj               27       4000 ind       23-JAN-97 m
        26 kartik            25       4800 ind
        11 sameer            39       5500 ind       11-NOV-86 m
        16 nick              29       7600 eng       27-JUN-03 u
        23 Steve             36       7700 aus       05-MAY-02 m
        18 Lance             42       8900 sa        05-DEC-95 m
        19 mark              37       9000 aus       18-MAR-99 m
        23 William           25       9700 nz        19-JAN-88 u

11 rows selected.


SQL> select PHONE,AGE from worker where SAL BETWEEN 45000 AND 60000;

     PHONE        AGE
---------- ----------
    763455         35
    371189         45



SQL> select * from emp where STATUS='u';

        ID NAME             AGE        SAL LOC       DOJ       STATU
---------- --------- ---------- ---------- --------- --------- -----
        16 nick              29       7600 eng       27-JUN-03 u
        23 William           25       9700 nz        19-JAN-88 u
        27 Priti             31       2600 ind       13-APR-97 u


SQL> commit;

Commit complete.


SQL> select ID from emp where STATUS='m' and LOC ='ind';

        ID
----------
        14
        11


SQL> select AGE,DOJ from emp where SAL > 7900;

       AGE DOJ
---------- ---------
        37 18-MAR-99
        25 19-JAN-88
        42 05-DEC-95

SQL> select * from emp where SAL!=5500 and SAL!=8900;

        ID NAME             AGE        SAL LOC       DOJ       STATU
---------- --------- ---------- ---------- --------- --------- -----
        14 raj               27       4000 ind       23-JAN-97 m
        19 mark              37       9000 aus       18-MAR-99 m
        16 nick              29       7600 eng       27-JUN-03 u
        23 William           25       9700 nz        19-JAN-88 u
        23 ahmed             30       1500 Pak                 m
        23 Steve             36       7700 aus       05-MAY-02 m
        26 kartik            25       4800 ind
        18 collin            22       2000 eng       16-NOV-95 m
        27 Priti             31       2600 ind       13-APR-97 u

9 rows selected.


SQL> select ID from emp where LOC='ind' OR SAL>6000;

        ID
----------
        14
        19
        16
        11
        23
        23
        26
        27
        18

9 rows selected.


SQL> select NAME,LOC from emp where DOJ is null;

NAME      LOC
--------- ---------
ahmed     Pak
kartik    ind


SQL> select AGE from emp where DOJ is null OR STATUS is null;

       AGE
----------
        30
        25


SQL> select * from emp where NAME LIKE 'm%' AND SAL >6000;

        ID NAME             AGE        SAL LOC       DOJ       STATU
---------- --------- ---------- ---------- --------- --------- -----
        19 mark              37       9000 aus       18-MAR-99 m


SQL>